{
  "$schema": "../../../../../schemas/route.schema.json",
  "schemaVersion": 1,
  "recordType": "route",
  "id": "ruby-life-pools/pug-10-15-baseline",
  "status": "draft",
  "validity": { "fromBuild": "12.1.0.69587", "untilBuild": null, "seasonId": null, "seasonSlug": "midnight-season-2" },
  "dungeonId": "ruby-life-pools",
  "challengeMapId": 399,
  "instanceMapId": 2521,
  "title": "Ruby Life Pools PUG baseline for +10 to +15",
  "routeKind": "pug",
  "targetEnemyForces": 552,
  "keyLevel": { "minimum": 10, "maximum": 15 },
  "affixIds": [],
  "mdtImport": null,
  "pulls": [
    { "id": "opening-courtyard-large", "order": 1, "enemies": [{ "npcId": 187969, "count": 4, "enemyForcesEach": 5 }, { "npcId": 188011, "count": 2, "enemyForcesEach": 5 }, { "npcId": 188067, "count": 1, "enemyForcesEach": 7 }, { "npcId": 188244, "count": 1, "enemyForcesEach": 25 }], "enemyForces": 62, "cumulativeEnemyForces": 62, "afterEncounterId": null, "dangerousSpellIds": [371984, 372743, 384933], "notes": "Bloodlust candidate. Chain stops on the Chillweaver and Guardian casts; keep the large opening pull planted for cleave." },
    { "id": "opening-courtyard-second", "order": 2, "enemies": [{ "npcId": 187969, "count": 1, "enemyForcesEach": 5 }, { "npcId": 188011, "count": 3, "enemyForcesEach": 5 }, { "npcId": 188067, "count": 3, "enemyForcesEach": 7 }, { "npcId": 188244, "count": 1, "enemyForcesEach": 25 }], "enemyForces": 66, "cumulativeEnemyForces": 128, "afterEncounterId": null, "dangerousSpellIds": [371984, 372743, 384933], "notes": "Assign multiple ranged interrupts before engaging because three Chillweavers overlap with a Juggernaut." },
    { "id": "draghar-gate", "order": 3, "enemies": [{ "npcId": 187894, "count": 3, "enemyForcesEach": 0 }, { "npcId": 187897, "count": 1, "enemyForcesEach": 30 }, { "npcId": 187969, "count": 1, "enemyForcesEach": 5 }, { "npcId": 188011, "count": 1, "enemyForcesEach": 5 }, { "npcId": 188067, "count": 1, "enemyForcesEach": 7 }], "enemyForces": 47, "cumulativeEnemyForces": 175, "afterEncounterId": null, "dangerousSpellIds": [371984, 372743, 384933, 1305234], "notes": "Defier Draghar is mandatory progression. Dispel Cold Claws from the whelps and finish the mixed casters before the boss." },
    { "id": "melidrussa-chillworn", "order": 4, "enemies": [{ "npcId": 188252, "count": 1, "enemyForcesEach": 0 }], "enemyForces": 0, "cumulativeEnemyForces": 175, "afterEncounterId": 2609, "dangerousSpellIds": [372808, 372851, 373680, 396044], "notes": "Dodge Hailbursts, stay out of Chillstorm's center, interrupt Frigid Shard, then break Frost Overload so casts can be stopped again." },
    { "id": "upper-ring-first", "order": 5, "enemies": [{ "npcId": 190034, "count": 1, "enemyForcesEach": 25 }, { "npcId": 190206, "count": 2, "enemyForcesEach": 7 }, { "npcId": 190207, "count": 2, "enemyForcesEach": 7 }], "enemyForces": 53, "cumulativeEnemyForces": 228, "afterEncounterId": null, "dangerousSpellIds": [373972, 384194, 1305955], "notes": "Interrupt the Destroyer and Cinderweavers, purge Blaze of Glory, and avoid spreading the pack around the ring." },
    { "id": "upper-ring-flamegullet", "order": 6, "enemies": [{ "npcId": 190034, "count": 1, "enemyForcesEach": 25 }, { "npcId": 190206, "count": 1, "enemyForcesEach": 7 }, { "npcId": 190207, "count": 1, "enemyForcesEach": 7 }, { "npcId": 197697, "count": 1, "enemyForcesEach": 40 }], "enemyForces": 79, "cumulativeEnemyForces": 307, "afterEncounterId": null, "dangerousSpellIds": [373972, 384194, 1305955], "notes": "Treat Flamegullet as the priority threat and avoid adding nearby patrols while covering the caster interrupts." },
    { "id": "upper-ring-third", "order": 7, "enemies": [{ "npcId": 190034, "count": 1, "enemyForcesEach": 25 }, { "npcId": 190206, "count": 2, "enemyForcesEach": 7 }, { "npcId": 190207, "count": 2, "enemyForcesEach": 7 }], "enemyForces": 53, "cumulativeEnemyForces": 360, "afterEncounterId": null, "dangerousSpellIds": [373972, 384194, 1305955], "notes": "Repeat the assigned interrupt order and purge Blaze of Glory before it amplifies the pack." },
    { "id": "upper-ring-fourth", "order": 8, "enemies": [{ "npcId": 190034, "count": 1, "enemyForcesEach": 25 }, { "npcId": 190206, "count": 2, "enemyForcesEach": 7 }, { "npcId": 190207, "count": 2, "enemyForcesEach": 7 }], "enemyForces": 53, "cumulativeEnemyForces": 413, "afterEncounterId": null, "dangerousSpellIds": [373972, 384194, 1305955], "notes": "Keep this as a separate PUG pull rather than chaining it into Kokia; preserve room and cooldowns for the boss." },
    { "id": "kokia-blazehoof", "order": 9, "enemies": [{ "npcId": 189232, "count": 1, "enemyForcesEach": 0 }], "enemyForces": 0, "cumulativeEnemyForces": 413, "afterEncounterId": 2606, "dangerousSpellIds": [372107, 372858, 372863, 373017], "notes": "Place Ritual adds close, interrupt Blaze Volley, bait Molten Boulder toward a safe wall, and rotate tank mitigation for Searing Blows." },
    { "id": "storm-approach-first", "order": 10, "enemies": [{ "npcId": 197509, "count": 6, "enemyForcesEach": 0 }, { "npcId": 197982, "count": 2, "enemyForcesEach": 5 }, { "npcId": 198047, "count": 1, "enemyForcesEach": 25 }], "enemyForces": 35, "cumulativeEnemyForces": 448, "afterEncounterId": null, "dangerousSpellIds": [391031, 392576], "notes": "Interrupt the Tempest Channeler and purge Stormcloud Barrier; the Thunderclouds add no enemy forces." },
    { "id": "storm-approach-second", "order": 11, "enemies": [{ "npcId": 190206, "count": 1, "enemyForcesEach": 7 }, { "npcId": 190207, "count": 1, "enemyForcesEach": 7 }, { "npcId": 197509, "count": 1, "enemyForcesEach": 0 }, { "npcId": 197982, "count": 5, "enemyForcesEach": 5 }, { "npcId": 198047, "count": 1, "enemyForcesEach": 25 }], "enemyForces": 64, "cumulativeEnemyForces": 512, "afterEncounterId": null, "dangerousSpellIds": [373972, 384194, 391031, 392576], "notes": "This mixed pull needs both interrupts and a purge assignment; use defensives if casts or the Barrier overlap." },
    { "id": "ryvati-platform", "order": 12, "enemies": [{ "npcId": 197509, "count": 8, "enemyForcesEach": 0 }, { "npcId": 197535, "count": 1, "enemyForcesEach": 30 }, { "npcId": 197982, "count": 2, "enemyForcesEach": 5 }], "enemyForces": 40, "cumulativeEnemyForces": 552, "afterEncounterId": null, "dangerousSpellIds": [391031], "notes": "Finish count on High Channeler Ryvati's platform and purge Thundercloud barriers before engaging the final boss." },
    { "id": "kyrakka-and-erkhart", "order": 13, "enemies": [{ "npcId": 190484, "count": 1, "enemyForcesEach": 0 }, { "npcId": 190485, "count": 1, "enemyForcesEach": 0 }, { "npcId": 197509, "count": 3, "enemyForcesEach": 0 }], "enemyForces": 0, "cumulativeEnemyForces": 552, "afterEncounterId": 2623, "dangerousSpellIds": [381512, 381516, 381525, 381602], "notes": "Prioritize Kyrakka whenever the dragon is attackable, avoid the breath, stop Cloudburst, place Inferno Spit at the edge, and dispel Stormslam safely." }
  ],
  "provenance": [
    { "kind": "external-reference", "description": "Original WHELP transcription and normalization of the current Skandar Tank Ruby Life Pools +10 to +15 route revision 3; the source displays ten enemy-forces pulls totaling 552/551 plus the final boss pull.", "url": "https://keystone.guru/route/ruby-life-pools/Xnxx3lT/skandar-tank-ruby-life-pools-10-to-15/3", "retrievedAt": "2026-09-02T13:24:30+02:00" },
    { "kind": "external-reference", "description": "Author context states the season routes were updated from live runs for PUG/LFG and Resilient progression; feedback specifically motivated reducing the earlier Ruby Life Pools opening pull.", "url": "https://www.reddit.com/r/WOWMythicPlus/comments/1vvp84d/updated_mythic_routes_for_midnight_season_2_aimed/", "retrievedAt": "2026-09-02T13:24:30+02:00" },
    { "kind": "external-reference", "description": "Pull notes are original compact summaries corroborated against Wowhead's Patch 12.1 dungeon overview, including current interrupt, dispel, purge, and boss priorities.", "url": "https://www.wowhead.com/guide/midnight/ruby-life-pools-dungeon-overview-mythic-plus", "retrievedAt": "2026-09-02T13:24:30+02:00" },
    { "kind": "game-data", "description": "NPC identifiers and per-unit enemy-forces values corroborated against installed Mythic Dungeon Tools 6.2.10 Retail data.", "url": "https://github.com/Nnoggie/MythicDungeonTools", "retrievedAt": "2026-09-02T13:24:30+02:00" }
  ]
}
