{
  "$schema": "../../../../../schemas/route.schema.json",
  "schemaVersion": 1,
  "recordType": "route",
  "id": "kings-rest/pug-10-15-baseline",
  "status": "draft",
  "validity": { "fromBuild": "12.1.0.69587", "untilBuild": null, "seasonId": null, "seasonSlug": "midnight-season-2" },
  "dungeonId": "kings-rest",
  "challengeMapId": 249,
  "instanceMapId": 1762,
  "title": "King's Rest PUG baseline for +10 to +15",
  "routeKind": "pug",
  "targetEnemyForces": 617,
  "keyLevel": { "minimum": 10, "maximum": 15 },
  "affixIds": [],
  "mdtImport": null,
  "pulls": [
    { "id": "opening-minions", "order": 1, "enemies": [{ "npcId": 133943, "count": 8, "enemyForcesEach": 0 }], "enemyForces": 0, "cumulativeEnemyForces": 0, "afterEncounterId": null, "dangerousSpellIds": [269935], "notes": "Purge Bound by Shadow to remove the opening Minions quickly; prepare Bloodlust for the following guardian pull." },
    { "id": "opening-guardians", "order": 2, "enemies": [{ "npcId": 133935, "count": 2, "enemyForcesEach": 22 }], "enemyForces": 44, "cumulativeEnemyForces": 44, "afterEncounterId": null, "dangerousSpellIds": [270003, 270016, 1310755], "notes": "Conservative PUG line: defeat both guardians and use Bloodlust. Coordinated groups can skip them and recover count later." },
    { "id": "first-shadow-pack", "order": 3, "enemies": [{ "npcId": 134157, "count": 4, "enemyForcesEach": 5 }, { "npcId": 134158, "count": 1, "enemyForcesEach": 25 }, { "npcId": 134174, "count": 1, "enemyForcesEach": 20 }], "enemyForces": 65, "cumulativeEnemyForces": 109, "afterEncounterId": null, "dangerousSpellIds": [269972, 269976, 1294815], "notes": "Assign Hex Volley interrupts and remove Ancestral Fury from the champion." },
    { "id": "second-shadow-pack", "order": 4, "enemies": [{ "npcId": 133943, "count": 5, "enemyForcesEach": 0 }, { "npcId": 134157, "count": 2, "enemyForcesEach": 5 }, { "npcId": 134158, "count": 1, "enemyForcesEach": 25 }], "enemyForces": 35, "cumulativeEnemyForces": 144, "afterEncounterId": null, "dangerousSpellIds": [269935, 269976], "notes": "Purge Minions and the champion buff; keep the pack controlled before the boss." },
    { "id": "golden-serpent", "order": 5, "enemies": [{ "npcId": 135322, "count": 1, "enemyForcesEach": 0 }, { "npcId": 135406, "count": 5, "enemyForcesEach": 0 }], "enemyForces": 0, "cumulativeEnemyForces": 144, "afterEncounterId": 2139, "dangerousSpellIds": [1311987, 265773, 265923, 265910], "notes": "Stack Molten Gold pools and kill all Animated Gold before they reach the boss." },
    { "id": "royal-procession", "order": 6, "enemies": [{ "npcId": 134251, "count": 1, "enemyForcesEach": 10 }, { "npcId": 134331, "count": 1, "enemyForcesEach": 25 }, { "npcId": 137473, "count": 1, "enemyForcesEach": 10 }, { "npcId": 137474, "count": 1, "enemyForcesEach": 25 }, { "npcId": 137478, "count": 1, "enemyForcesEach": 25 }, { "npcId": 137484, "count": 1, "enemyForcesEach": 25 }, { "npcId": 137485, "count": 4, "enemyForcesEach": 7 }, { "npcId": 137486, "count": 1, "enemyForcesEach": 25 }, { "npcId": 137487, "count": 1, "enemyForcesEach": 10 }], "enemyForces": 183, "cumulativeEnemyForces": 327, "afterEncounterId": null, "dangerousSpellIds": [270901, 270920, 1294972, 1296671, 1297763, 1306763], "notes": "Large fixed event pull. Assign interrupts, purge enemy buffs, and use crowd control and defensives deliberately." },
    { "id": "purification-room", "order": 7, "enemies": [{ "npcId": 134739, "count": 1, "enemyForcesEach": 25 }, { "npcId": 137989, "count": 7, "enemyForcesEach": 1 }], "enemyForces": 32, "cumulativeEnemyForces": 359, "afterEncounterId": null, "dangerousSpellIds": [1298104], "notes": "Avoid or remove the Embalming Fluid poison while controlling the construct." },
    { "id": "first-interment-pack", "order": 8, "enemies": [{ "npcId": 137969, "count": 1, "enemyForcesEach": 15 }, { "npcId": 137989, "count": 2, "enemyForcesEach": 1 }, { "npcId": 270502, "count": 2, "enemyForcesEach": 7 }], "enemyForces": 31, "cumulativeEnemyForces": 390, "afterEncounterId": null, "dangerousSpellIds": [1298104, 267763], "notes": "Interrupt Wretched Discharge and remove fluid poisons." },
    { "id": "second-interment-pack", "order": 9, "enemies": [{ "npcId": 137969, "count": 1, "enemyForcesEach": 15 }, { "npcId": 137989, "count": 8, "enemyForcesEach": 1 }, { "npcId": 270502, "count": 2, "enemyForcesEach": 7 }], "enemyForces": 37, "cumulativeEnemyForces": 427, "afterEncounterId": null, "dangerousSpellIds": [1298104, 267763], "notes": "Keep the mummy casts locked down while clearing the larger fluid set." },
    { "id": "mchimba", "order": 10, "enemies": [{ "npcId": 134993, "count": 1, "enemyForcesEach": 0 }, { "npcId": 136256, "count": 1, "enemyForcesEach": 0 }], "enemyForces": 0, "cumulativeEnemyForces": 427, "afterEncounterId": 2142, "dangerousSpellIds": [267618, 267639, 267702, 1312146], "notes": "Free Entomb targets quickly and interrupt summoned mummies." },
    { "id": "first-ancestor-hall", "order": 11, "enemies": [{ "npcId": 135167, "count": 2, "enemyForcesEach": 22 }, { "npcId": 135204, "count": 2, "enemyForcesEach": 7 }, { "npcId": 135239, "count": 2, "enemyForcesEach": 7 }, { "npcId": 137591, "count": 1, "enemyForcesEach": 0 }], "enemyForces": 72, "cumulativeEnemyForces": 499, "afterEncounterId": null, "dangerousSpellIds": [270492, 1295125, 270499], "notes": "Kill Healing Tide Totem immediately and assign Hex interrupts." },
    { "id": "second-ancestor-hall", "order": 12, "enemies": [{ "npcId": 135192, "count": 2, "enemyForcesEach": 5 }, { "npcId": 135204, "count": 1, "enemyForcesEach": 7 }, { "npcId": 135231, "count": 1, "enemyForcesEach": 25 }, { "npcId": 135239, "count": 2, "enemyForcesEach": 7 }, { "npcId": 137591, "count": 1, "enemyForcesEach": 0 }], "enemyForces": 56, "cumulativeEnemyForces": 555, "afterEncounterId": null, "dangerousSpellIds": [270492, 1295125, 270499], "notes": "Focus the Healing Tide Totem, control the brute, and stop Hex." },
    { "id": "final-ancestor-pack", "order": 13, "enemies": [{ "npcId": 135167, "count": 1, "enemyForcesEach": 22 }, { "npcId": 135192, "count": 2, "enemyForcesEach": 5 }], "enemyForces": 32, "cumulativeEnemyForces": 587, "afterEncounterId": null, "dangerousSpellIds": [], "notes": "Clear the final trash before Council." },
    { "id": "council-of-tribes", "order": 14, "enemies": [{ "npcId": 135761, "count": 1, "enemyForcesEach": 0 }, { "npcId": 135764, "count": 1, "enemyForcesEach": 0 }, { "npcId": 135765, "count": 1, "enemyForcesEach": 0 }, { "npcId": 269808, "count": 1, "enemyForcesEach": 0 }, { "npcId": 269810, "count": 1, "enemyForcesEach": 0 }, { "npcId": 269811, "count": 1, "enemyForcesEach": 0 }], "enemyForces": 0, "cumulativeEnemyForces": 587, "afterEncounterId": 2140, "dangerousSpellIds": [267494, 266237, 267273, 267060], "notes": "Stack Barrel Through, interrupt Poison Nova, and kill Explosive Totem first." },
    { "id": "shadow-of-zul", "order": 15, "enemies": [{ "npcId": 138489, "count": 1, "enemyForcesEach": 30 }, { "npcId": 138493, "count": 1, "enemyForcesEach": 0 }], "enemyForces": 30, "cumulativeEnemyForces": 617, "afterEncounterId": null, "dangerousSpellIds": [269935], "notes": "Hold the required soaks, spread targeted circles, and purge the Minion of Zul." },
    { "id": "king-dazar", "order": 16, "enemies": [{ "npcId": 136160, "count": 1, "enemyForcesEach": 0 }, { "npcId": 136976, "count": 1, "enemyForcesEach": 0 }, { "npcId": 136984, "count": 1, "enemyForcesEach": 0 }], "enemyForces": 0, "cumulativeEnemyForces": 617, "afterEncounterId": 2143, "dangerousSpellIds": [269369, 268586, 1303267, 1303327], "notes": "Interrupt Deathly Roar, spread leaps, and avoid Dazar's empowered frontal waves." }
  ],
  "provenance": [
    { "kind": "external-reference", "description": "Original WHELP transcription and normalization of the public Skandar Tank King's Rest +10 to +15 route; source displayed 16 meaningful pulls and 617/608 forces.", "url": "https://keystone.guru/route/kings-rest/eMIO4TP/skandar-tank-kings-rest-10-to-15", "retrievedAt": "2026-09-02T16:30:00+02:00" },
    { "kind": "external-reference", "description": "Author context states the routes were updated from live runs for PUG/LFG and Resilient progression; discussion documents the optional opening-guardian skip for coordinated groups.", "url": "https://www.reddit.com/r/WOWMythicPlus/comments/1vvp84d/updated_mythic_routes_for_midnight_season_2_aimed/", "retrievedAt": "2026-09-02T16:30:00+02:00" },
    { "kind": "game-data", "description": "NPC identifiers and per-unit enemy-forces values corroborated against installed Mythic Dungeon Tools 6.2.10 Retail data.", "url": "https://github.com/Nnoggie/MythicDungeonTools", "retrievedAt": "2026-09-02T16:30:00+02:00" }
  ]
}
