{
  "$schema": "../../../../../schemas/route.schema.json",
  "schemaVersion": 1,
  "recordType": "route",
  "id": "altar-of-fangs/pug-10-15-baseline",
  "status": "draft",
  "validity": { "fromBuild": "12.1.0.69587", "untilBuild": null, "seasonId": null, "seasonSlug": "midnight-season-2" },
  "dungeonId": "altar-of-fangs",
  "challengeMapId": 588,
  "instanceMapId": 2993,
  "title": "Altar of Fangs PUG baseline for +10 to +15",
  "routeKind": "pug",
  "targetEnemyForces": 832,
  "keyLevel": { "minimum": 10, "maximum": 15 },
  "affixIds": [],
  "mdtImport": null,
  "pulls": [
    { "id": "opening-descendants", "order": 1, "enemies": [{ "npcId": 261560, "count": 2, "enemyForcesEach": 7 }, { "npcId": 261553, "count": 7, "enemyForcesEach": 5 }, { "npcId": 261554, "count": 1, "enemyForcesEach": 25 }, { "npcId": 261550, "count": 3, "enemyForcesEach": 1 }], "enemyForces": 77, "cumulativeEnemyForces": 77, "afterEncounterId": null, "dangerousSpellIds": [1294557, 1294569, 1306308], "notes": "Use Bloodlust if planned, soothe or briefly control the Descendants' Ravenous Claws, interrupt Piercing Hiss, and remove Paralyzing Shots." },
    { "id": "first-chieftain-pack", "order": 2, "enemies": [{ "npcId": 270306, "count": 1, "enemyForcesEach": 25 }, { "npcId": 261560, "count": 3, "enemyForcesEach": 7 }, { "npcId": 261553, "count": 2, "enemyForcesEach": 5 }], "enemyForces": 56, "cumulativeEnemyForces": 133, "afterEncounterId": null, "dangerousSpellIds": [1294557, 1306308], "notes": "Keep this separate from the opening pull for the PUG baseline; stop Piercing Hiss and give the tank room to reset Descendant attack-speed pressure." },
    { "id": "second-chieftain-pack", "order": 3, "enemies": [{ "npcId": 270306, "count": 1, "enemyForcesEach": 25 }, { "npcId": 261560, "count": 3, "enemyForcesEach": 7 }, { "npcId": 261553, "count": 2, "enemyForcesEach": 5 }, { "npcId": 261550, "count": 3, "enemyForcesEach": 1 }], "enemyForces": 59, "cumulativeEnemyForces": 192, "afterEncounterId": null, "dangerousSpellIds": [1294557, 1306308], "notes": "Rotate Serpent kicks, clear the Chieftain's group healing absorb, and use a tank defensive for its heavy physical hit." },
    { "id": "third-chieftain-pack", "order": 4, "enemies": [{ "npcId": 270306, "count": 1, "enemyForcesEach": 25 }, { "npcId": 261560, "count": 2, "enemyForcesEach": 7 }, { "npcId": 261553, "count": 6, "enemyForcesEach": 5 }], "enemyForces": 69, "cumulativeEnemyForces": 261, "afterEncounterId": null, "dangerousSpellIds": [1294557, 1306308], "notes": "The six Descendants make this a tank-control check: stagger AoE stops and kiting while the group activates the required opening-area totems." },
    { "id": "fourth-chieftain-pack", "order": 5, "enemies": [{ "npcId": 270306, "count": 1, "enemyForcesEach": 25 }, { "npcId": 261560, "count": 2, "enemyForcesEach": 7 }, { "npcId": 261553, "count": 2, "enemyForcesEach": 5 }], "enemyForces": 49, "cumulativeEnemyForces": 310, "afterEncounterId": null, "dangerousSpellIds": [1294557, 1306308], "notes": "Finish the remaining required totem interactions, interrupt both Serpents, and avoid adding the nearby Harrowers before this pack is controlled." },
    { "id": "double-harrower", "order": 6, "enemies": [{ "npcId": 261554, "count": 2, "enemyForcesEach": 25 }], "enemyForces": 50, "cumulativeEnemyForces": 360, "afterEncounterId": null, "dangerousSpellIds": [1294569], "notes": "Chain this after the prior pack rather than combining it by default; remove Paralyzing Shots and dodge the Harrowers' rotating breath." },
    { "id": "ravi", "order": 7, "enemies": [{ "npcId": 259445, "count": 1, "enemyForcesEach": 0 }], "enemyForces": 0, "cumulativeEnemyForces": 360, "afterEncounterId": 3456, "dangerousSpellIds": [1296050, 1296220, 1307894, 1307921], "notes": "After Ravenous Stomp, move Rav'i to an empty Carrion Pile, break the feeding shield, spread for Triple Shot, and dodge Regurgitate." },
    { "id": "first-evolutionist-writhe", "order": 8, "enemies": [{ "npcId": 261552, "count": 4, "enemyForcesEach": 5 }, { "npcId": 261557, "count": 3, "enemyForcesEach": 7 }, { "npcId": 262011, "count": 1, "enemyForcesEach": 25 }], "enemyForces": 66, "cumulativeEnemyForces": 426, "afterEncounterId": null, "dangerousSpellIds": [1289416, 1294845, 1307567, 1307571], "notes": "Hard-control Evolve, interrupt the Evolutionists, dispel Envenom, and use a defensive for the Rattling Writhe's Corrosive Fangs." },
    { "id": "second-evolutionist-writhe", "order": 9, "enemies": [{ "npcId": 261552, "count": 7, "enemyForcesEach": 5 }, { "npcId": 261557, "count": 2, "enemyForcesEach": 7 }, { "npcId": 262011, "count": 1, "enemyForcesEach": 25 }], "enemyForces": 74, "cumulativeEnemyForces": 500, "afterEncounterId": null, "dangerousSpellIds": [1289416, 1294845, 1307567, 1307571], "notes": "Commit cooldowns to the large Bloodletter pack, reserve hard control for Evolve, and keep moving out of pools as the fixating enemies are cleaved." },
    { "id": "writhing-coil", "order": 10, "enemies": [{ "npcId": 261552, "count": 3, "enemyForcesEach": 5 }, { "npcId": 261557, "count": 2, "enemyForcesEach": 7 }, { "npcId": 262011, "count": 1, "enemyForcesEach": 25 }, { "npcId": 259446, "count": 1, "enemyForcesEach": 0 }, { "npcId": 262398, "count": 2, "enemyForcesEach": 0 }, { "npcId": 270417, "count": 2, "enemyForcesEach": 0 }], "enemyForces": 54, "cumulativeEnemyForces": 554, "afterEncounterId": 3457, "dangerousSpellIds": [1289416, 1294845, 1305368, 1307567, 1307571, 1310547, 1310666], "notes": "Interrupt each Toxic Atrophy, have every living player run away together to break Death Rattle, dodge Burrowing Charge and Venom Jet, then control the Uncoiled Writhes." },
    { "id": "ascendant-and-blades", "order": 11, "enemies": [{ "npcId": 261557, "count": 4, "enemyForcesEach": 7 }, { "npcId": 261573, "count": 1, "enemyForcesEach": 30 }, { "npcId": 271453, "count": 5, "enemyForcesEach": 5 }], "enemyForces": 83, "cumulativeEnemyForces": 637, "afterEncounterId": null, "dangerousSpellIds": [1289416, 1307567, 1307571], "notes": "The Ascendant Serpent is a progression gate: hard-control every Evolve, group its fixating Hatchlings, stack tornado drops, and avoid overpulling extra Blades." },
    { "id": "chosen-and-living-venom", "order": 12, "enemies": [{ "npcId": 263112, "count": 6, "enemyForcesEach": 1 }, { "npcId": 263109, "count": 1, "enemyForcesEach": 25 }, { "npcId": 271453, "count": 4, "enemyForcesEach": 5 }], "enemyForces": 51, "cumulativeEnemyForces": 688, "afterEncounterId": null, "dangerousSpellIds": [1289416, 1306230, 1307567, 1307571], "notes": "Interrupt Mass Envenom, dodge Toxic Surge, and stagger Living Venom deaths so their explosions do not overlap while the tank manages the Blades." },
    { "id": "harrower-stair-pack", "order": 13, "enemies": [{ "npcId": 261560, "count": 2, "enemyForcesEach": 7 }, { "npcId": 261554, "count": 1, "enemyForcesEach": 25 }, { "npcId": 271453, "count": 4, "enemyForcesEach": 5 }], "enemyForces": 59, "cumulativeEnemyForces": 747, "afterEncounterId": null, "dangerousSpellIds": [1294557, 1294569], "notes": "Assign Piercing Hiss kicks, remove Paralyzing Shots, and let the tank establish the stair pack before the group closes in." },
    { "id": "zuljan-final-checkpoint", "order": 14, "enemies": [{ "npcId": 270306, "count": 2, "enemyForcesEach": 25 }, { "npcId": 263109, "count": 1, "enemyForcesEach": 25 }, { "npcId": 271453, "count": 2, "enemyForcesEach": 5 }, { "npcId": 259447, "count": 1, "enemyForcesEach": 0 }, { "npcId": 268358, "count": 1, "enemyForcesEach": 0 }], "enemyForces": 85, "cumulativeEnemyForces": 832, "afterEncounterId": 3458, "dangerousSpellIds": [1289416, 1300876, 1301111, 1301350, 1301413, 1307567, 1307571], "notes": "Handle the double-Chieftain and Chosen pressure before the final fight; on Zul'jan, preassign all four beam lanes and use Boneslicer at the edge to clear Ritual Venom." }
  ],
  "provenance": [
    { "kind": "external-reference", "description": "Original WHELP transcription and normalization of Skandar Tank Altar of Fangs revision 4. Keystone.guru flags the route as using an older mapping; the visible route has fourteen meaningful enemy slots plus one empty placeholder and totals 832/817.", "url": "https://keystone.guru/route/altar-of-fangs/xwt8Pza/skandar-tank-altar-of-fangs-10-to-15-keys/4", "retrievedAt": "2026-09-02T13:46:51+02:00" },
    { "kind": "external-reference", "description": "The public MDT2 export was decoded only as reconciliation evidence. Its eighth slot retains two High Evolutionist clone references while the rendered route visibly counts three; WHELP preserves the rendered three-enemy count and therefore leaves the route draft.", "url": "https://keystone.guru/route/altar-of-fangs/xwt8Pza/skandar-tank-altar-of-fangs-10-to-15-keys/4", "retrievedAt": "2026-09-02T13:46:51+02:00" },
    { "kind": "external-reference", "description": "Pull notes and boss checkpoints are original compact summaries corroborated against Wowhead's updated Patch 12.1 Altar of Fangs overview.", "url": "https://www.wowhead.com/guide/midnight/altar-of-fangs-dungeon-overview-location-rewards", "retrievedAt": "2026-09-02T13:46:51+02:00" },
    { "kind": "game-data", "description": "Current NPC identifiers, encounters, and per-unit enemy-forces values reconciled against installed Mythic Dungeon Tools 6.2.10 and DBM Dungeons r261 Retail data.", "url": "https://github.com/Nnoggie/MythicDungeonTools", "retrievedAt": "2026-09-02T13:46:51+02:00" }
  ]
}
