{
  "$schema": "../../../../../schemas/route.schema.json",
  "schemaVersion": 1,
  "recordType": "route",
  "id": "voidscar-arena/pug-10-15-baseline",
  "status": "draft",
  "validity": { "fromBuild": "12.1.0.69587", "untilBuild": null, "seasonId": null, "seasonSlug": "midnight-season-2" },
  "dungeonId": "voidscar-arena",
  "challengeMapId": 585,
  "instanceMapId": 2923,
  "title": "Voidscar Arena PUG baseline for +10 to +15",
  "routeKind": "pug",
  "targetEnemyForces": 738,
  "keyLevel": { "minimum": 10, "maximum": 15 },
  "affixIds": [],
  "mdtImport": null,
  "pulls": [
    { "id": "opening-mixed-pack", "order": 1, "enemies": [{ "npcId": 238883, "count": 1, "enemyForcesEach": 7 }, { "npcId": 241496, "count": 2, "enemyForcesEach": 7 }, { "npcId": 243985, "count": 2, "enemyForcesEach": 5 }, { "npcId": 243988, "count": 1, "enemyForcesEach": 4 }, { "npcId": 243996, "count": 1, "enemyForcesEach": 4 }, { "npcId": 252072, "count": 1, "enemyForcesEach": 25 }], "enemyForces": 64, "cumulativeEnemyForces": 64, "afterEncounterId": null, "dangerousSpellIds": [1228176, 1254826, 1298899, 1299938, 1310319], "notes": "Assign Shadowbolt Volley and Demoralizing Shout stops, dispel Melt Armor, and remove Bolster from the Tuskarr." },
    { "id": "rajkess-lieutenant", "order": 2, "enemies": [{ "npcId": 267546, "count": 1, "enemyForcesEach": 40 }], "enemyForces": 40, "cumulativeEnemyForces": 104, "afterEncounterId": null, "dangerousSpellIds": [], "notes": "Fight Raj'kess alone and keep movement controlled so the next animal group is not added accidentally." },
    { "id": "first-animal-wave", "order": 3, "enemies": [{ "npcId": 243983, "count": 3, "enemyForcesEach": 4 }, { "npcId": 243985, "count": 3, "enemyForcesEach": 5 }, { "npcId": 243988, "count": 3, "enemyForcesEach": 4 }, { "npcId": 243996, "count": 3, "enemyForcesEach": 4 }], "enemyForces": 51, "cumulativeEnemyForces": 155, "afterEncounterId": null, "dangerousSpellIds": [1249661, 1250043, 1310319], "notes": "Dispel Melt Armor and purge Bolster before the twelve-enemy wave amplifies itself." },
    { "id": "chitigoth-wave", "order": 4, "enemies": [{ "npcId": 243985, "count": 2, "enemyForcesEach": 5 }, { "npcId": 243988, "count": 2, "enemyForcesEach": 4 }, { "npcId": 244260, "count": 1, "enemyForcesEach": 25 }, { "npcId": 249603, "count": 1, "enemyForcesEach": 5 }, { "npcId": 249608, "count": 1, "enemyForcesEach": 5 }], "enemyForces": 53, "cumulativeEnemyForces": 208, "afterEncounterId": null, "dangerousSpellIds": [1249661, 1310319], "notes": "Burst the Protective Turtle after its shield falls and keep Bolster purged while focusing Chitigoth." },
    { "id": "brutok-wave", "order": 5, "enemies": [{ "npcId": 243983, "count": 2, "enemyForcesEach": 4 }, { "npcId": 243996, "count": 2, "enemyForcesEach": 4 }, { "npcId": 244309, "count": 1, "enemyForcesEach": 25 }, { "npcId": 249461, "count": 1, "enemyForcesEach": 5 }, { "npcId": 249590, "count": 1, "enemyForcesEach": 8 }], "enemyForces": 54, "cumulativeEnemyForces": 262, "afterEncounterId": null, "dangerousSpellIds": [1249238, 1249621, 1250043], "notes": "Face Brutok toward a wall so its charge stays short, interrupt Violent Sand, and dispel Melt Armor." },
    { "id": "tazrah", "order": 6, "enemies": [{ "npcId": 238887, "count": 1, "enemyForcesEach": 0 }], "enemyForces": 0, "cumulativeEnemyForces": 262, "afterEncounterId": 3285, "dangerousSpellIds": [1222098, 1300259], "notes": "Dodge each Nether Dash line and move away from the Void Fissures spawned by Dark Bloom." },
    { "id": "harrower-screamer", "order": 7, "enemies": [{ "npcId": 241496, "count": 1, "enemyForcesEach": 7 }, { "npcId": 243766, "count": 1, "enemyForcesEach": 7 }, { "npcId": 243835, "count": 1, "enemyForcesEach": 5 }, { "npcId": 245950, "count": 1, "enemyForcesEach": 65 }], "enemyForces": 84, "cumulativeEnemyForces": 346, "afterEncounterId": null, "dangerousSpellIds": [1228176, 1233398, 1239855], "notes": "Stop Mad Shriek and the Shaman cast while focusing the high-value Watchful Harrower." },
    { "id": "harrower-overseer", "order": 8, "enemies": [{ "npcId": 238883, "count": 1, "enemyForcesEach": 7 }, { "npcId": 241496, "count": 1, "enemyForcesEach": 7 }, { "npcId": 245950, "count": 1, "enemyForcesEach": 65 }, { "npcId": 252053, "count": 1, "enemyForcesEach": 25 }], "enemyForces": 104, "cumulativeEnemyForces": 450, "afterEncounterId": null, "dangerousSpellIds": [1228176, 1239855, 1254826, 1298899], "notes": "Use major cooldowns on the Harrower and Overseer combination and assign both Shaman and Brawler stops." },
    { "id": "atroxus", "order": 9, "enemies": [{ "npcId": 239008, "count": 1, "enemyForcesEach": 0 }, { "npcId": 239070, "count": 2, "enemyForcesEach": 0 }], "enemyForces": 0, "cumulativeEnemyForces": 450, "afterEncounterId": 3286, "dangerousSpellIds": [1226031, 1262497, 1263971], "notes": "Dodge Poison Splash and the frontal breath, kill each fixating Creeper quickly, and plan defensives for Monstrous Roar." },
    { "id": "open-field-brutalizer", "order": 10, "enemies": [{ "npcId": 243835, "count": 2, "enemyForcesEach": 5 }, { "npcId": 243983, "count": 2, "enemyForcesEach": 4 }, { "npcId": 243988, "count": 2, "enemyForcesEach": 4 }, { "npcId": 244708, "count": 2, "enemyForcesEach": 7 }, { "npcId": 252508, "count": 10, "enemyForcesEach": 1 }, { "npcId": 268184, "count": 1, "enemyForcesEach": 30 }], "enemyForces": 80, "cumulativeEnemyForces": 530, "afterEncounterId": null, "dangerousSpellIds": [1250043, 1310324], "notes": "Interrupt Mending Void and kill any mob targeted for Devour before the Brutalizer can heal." },
    { "id": "open-field-control-pack", "order": 11, "enemies": [{ "npcId": 238883, "count": 1, "enemyForcesEach": 7 }, { "npcId": 241496, "count": 1, "enemyForcesEach": 7 }, { "npcId": 243766, "count": 2, "enemyForcesEach": 7 }, { "npcId": 243835, "count": 2, "enemyForcesEach": 5 }, { "npcId": 243983, "count": 1, "enemyForcesEach": 4 }, { "npcId": 243996, "count": 1, "enemyForcesEach": 4 }, { "npcId": 244708, "count": 2, "enemyForcesEach": 7 }, { "npcId": 268184, "count": 1, "enemyForcesEach": 30 }], "enemyForces": 90, "cumulativeEnemyForces": 620, "afterEncounterId": null, "dangerousSpellIds": [1228176, 1233398, 1250043, 1254826, 1298899, 1310324], "notes": "This mixed open-field pull needs a full stop order: prioritize Mad Shriek, Mending Void, Demoralizing Shout, and Devour prevention." },
    { "id": "open-field-siphoids", "order": 12, "enemies": [{ "npcId": 238883, "count": 1, "enemyForcesEach": 7 }, { "npcId": 243766, "count": 1, "enemyForcesEach": 7 }, { "npcId": 243835, "count": 2, "enemyForcesEach": 5 }, { "npcId": 243988, "count": 1, "enemyForcesEach": 4 }, { "npcId": 243996, "count": 1, "enemyForcesEach": 4 }, { "npcId": 252508, "count": 10, "enemyForcesEach": 1 }], "enemyForces": 42, "cumulativeEnemyForces": 662, "afterEncounterId": null, "dangerousSpellIds": [1233398, 1254826, 1298899], "notes": "Keep the Siphoids grouped for efficient cleave while stopping the Screamer and Brawler." },
    { "id": "final-open-field-pack", "order": 13, "enemies": [{ "npcId": 241496, "count": 1, "enemyForcesEach": 7 }, { "npcId": 243766, "count": 1, "enemyForcesEach": 7 }, { "npcId": 243835, "count": 2, "enemyForcesEach": 5 }, { "npcId": 243996, "count": 2, "enemyForcesEach": 4 }, { "npcId": 244708, "count": 2, "enemyForcesEach": 7 }, { "npcId": 268184, "count": 1, "enemyForcesEach": 30 }], "enemyForces": 76, "cumulativeEnemyForces": 738, "afterEncounterId": null, "dangerousSpellIds": [1228176, 1233398, 1310324], "notes": "Finish exact count here; stop Mad Shriek and Mending Void, and prevent the final Brutalizer from completing Devour." },
    { "id": "charonus", "order": 14, "enemies": [{ "npcId": 248015, "count": 1, "enemyForcesEach": 0 }], "enemyForces": 0, "cumulativeEnemyForces": 738, "afterEncounterId": 3287, "dangerousSpellIds": [1222755, 1223298, 1227197, 1264191], "notes": "Coordinate orb targets with pings, kite each Gravitic Orb into an Unstable Singularity, dodge Cosmic Crash, and move around Charonus during Void Cascade." }
  ],
  "provenance": [
    { "kind": "external-reference", "description": "Original WHELP transcription and normalization of the current Skandar Tank Voidscar Arena +10 to +15 route revision 4; the source displays twelve enemy-forces pulls totaling exactly 738/738.", "url": "https://keystone.guru/route/voidscar-arena/LHXRfPr/skandar-tank-voidscar-arena-season-2-10-to-15/4", "retrievedAt": "2026-09-02T13:32:23+02:00" },
    { "kind": "external-reference", "description": "Author context states the season routes were updated from live runs for PUG/LFG and Resilient progression.", "url": "https://www.reddit.com/r/WOWMythicPlus/comments/1vvp84d/updated_mythic_routes_for_midnight_season_2_aimed/", "retrievedAt": "2026-09-02T13:32:23+02:00" },
    { "kind": "external-reference", "description": "Pull notes and inserted boss checkpoints are original compact summaries corroborated against Wowhead's updated Patch 12.1 Voidscar Arena overview.", "url": "https://www.wowhead.com/guide/midnight/voidscar-arena-dungeon-overview-location-rewards", "retrievedAt": "2026-09-02T13:32:23+02:00" },
    { "kind": "game-data", "description": "NPC identifiers and per-unit enemy-forces values corroborated against installed Mythic Dungeon Tools 6.2.10 Retail data.", "url": "https://github.com/Nnoggie/MythicDungeonTools", "retrievedAt": "2026-09-02T13:32:23+02:00" }
  ]
}
